<?xml version="1.0" encoding="UTF-8"?>
<docblox
    xmlns:xsi="http://www.w3.org/2001/XMLSchema-instance"
    xsi:noNamespaceSchemaLocation="docblox.xsd"
>
    <title>PEAR2_Net_RouterOS documentation</title>
    <parser>
        <default-package-name>PEAR2_Net_RouterOS</default-package-name>
        <target>PEAR2_Net_RouterOS__DocBlox_Documentation</target>
        <extensions>
            <extension>php</extension>
        </extensions>
    </parser>
    <files>
        <directory>../src/PEAR2/Net/RouterOS</directory>
    </files>
    <transformer>
        <target>PEAR2_Net_RouterOS__DocBlox_Documentation</target>
    </transformer>
</docblox>
